<?xml version="1.0" encoding="UTF-8"?>
<!DOCTYPE root SYSTEM "dictionary.dtd">
<root>

<entry>
<word>
ña 1</word>


<meaning>
{ña} the palatal nasal (found before palatal consonants)
</meaning>


</entry>

<entry>
<word>
 ñakāra </word>


<meaning>
{kāra} m. the letter {ñ}
</meaning>


</entry>

<entry>
<word>
ña 2</word>


<meaning>
{ña} m. a singer <a href="/html/abbreviations.html#L">L.</a> 
</meaning>


<meaning>
 a jingling sound <a href="/html/abbreviations.html#L">L.</a> 
</meaning>


<meaning>
 a heretic <a href="/html/abbreviations.html#L">L.</a> 
</meaning>


<meaning>
 an ox <a href="/html/abbreviations.html#L">L.</a> 
</meaning>


<meaning>
 the planet Śukra <a href="/html/abbreviations.html#L">L.</a>
</meaning>


</entry>

<entry>
<word>
 </word>


<meaning>
{}
</meaning>


</entry>

</root>
