<?xml version="1.0" encoding="UTF-8"?>
<!DOCTYPE root SYSTEM "dictionary.dtd">
<root>

<entry>
<word>
ṭha 1</word>


<meaning>
{ṭha} the aspirate of the preceding consonant
</meaning>


</entry>

<entry>
<word>
 ṭhakāra </word>


<meaning>
{kāra} m. the letter {ṭh} <a href="/html/abbreviations.html#Pāṇ">Pāṇ.</a> 8-4, 41 <a href="/html/abbreviations.html#Kāś">Kāś.</a> 
</meaning>


<meaning>
 {raya} Nom. (Desid. {ṭiṭh"ṣ "ṣyiṣatī}), 54 <a href="/html/abbreviations.html#Kāś">Kāś.</a>
</meaning>


</entry>

<entry>
<word>
ṭha 2</word>


<meaning>
{ṭha} m. a loud noise ({ṭhaṭhaṃ ṭhaṭhaṃ ṭhaṃ ṭhaṭhaṭhaṃ ṭhaṭhaṃ ṭhaḥ}, an imitative sound as of a golden pitcher rolling down steps <a href="/html/abbreviations.html#Mahān">Mahān.</a>2 iii, 5) <a href="/html/abbreviations.html#L">L.</a> 
</meaning>


<meaning>
 the moon's disk <a href="/html/abbreviations.html#L">L.</a> 
</meaning>


<meaning>
 a disk <a href="/html/abbreviations.html#L">L.</a> 
</meaning>


<meaning>
 a cypher <a href="/html/abbreviations.html#L">L.</a> 
</meaning>


<meaning>
 a place frequented by all <a href="/html/abbreviations.html#L">L.</a> 
</meaning>


<meaning>
 Śiva <a href="/html/abbreviations.html#L">L.</a>
</meaning>


</entry>

<entry>
<word>
ṭhaṃsarī </word>


<meaning>
{ṭhaṃsarī} f. N. of a stringed instrument
</meaning>


</entry>

<entry>
<word>
ṭhakka </word>


<meaning>
{ṭhakka} m. a merchant (= {ṭakka}) <a href="/html/abbreviations.html#Inscr">Inscr.</a> (Ist century AḌ.)
</meaning>


</entry>

<entry>
<word>
ṭhakkana </word>


<meaning>
{ṭhakkana} m. N. of a prince <a href="/html/abbreviations.html#Rājat">Rājat.</a> vi, 230ff. and 236 (vv.Il. {ḍkakk}, {thakk})
</meaning>


</entry>

<entry>
<word>
ṭhakkura </word>


<meaning>
{ṭhakkura} m. a deity, object of reverence, man of rank, chief (the modern 'Thākūr, Tagore' added to names), vii f. <a href="/html/abbreviations.html#Dhūrtas">Dhūrtas.</a> i, . 19/20
</meaning>


</entry>

<entry>
<word>
ṭhaṭhaṃ </word>


<meaning>
{ṭhaṭhaṃ} {ṭhaṭhaṭhaṃ}, See 2. {ṭha}
</meaning>


</entry>

<entry>
<word>
ṭhātkāra </word>


<meaning>
{ṭhāt-kāra} m. = {ṭāṃ-k} <a href="/html/abbreviations.html#Bālar">Bālar.</a> iii
</meaning>


</entry>

<entry>
<word>
ṭhāra </word>


<meaning>
{ṭhāra} rime <a href="/html/abbreviations.html#KātyŚr">KātyŚr.</a> xv, 4, 38 <a href="/html/abbreviations.html#Sch">Sch.</a>
</meaning>


</entry>

<entry>
<word>
ṭhiṇṭhā </word>


<meaning>
{ṭhiṇṭhā} f. a gaming-house <a href="/html/abbreviations.html#Kathās">Kathās.</a> xcī, 15 and 21 ({ṭiṇ}), cxxiv, 211 
</meaning>


<meaning>
 N. of a woman <a href="/html/abbreviations.html#Rājat">Rājat.</a> vii, 103
</meaning>


</entry>

<entry>
<word>
 ṭhiṇṭhākarāla </word>


<meaning>
{karāla} m. N. of a gaming-house keeper <a href="/html/abbreviations.html#Kathās">Kathās.</a> cxxi, 71f
</meaning>


</entry>

<entry>
<word>
ṭhetkṛta </word>


<meaning>
{ṭhet-kṛta} n. the roaring (of a bull) <a href="/html/abbreviations.html#Alaṃkārat">Alaṃkārat.</a>
</meaning>


</entry>

<entry>
<word>
ṭhoṇṭhapaddhahati </word>


<meaning>
{ṭhoṇṭha-paddhahati} f. N. of wk., Śūdradh.
</meaning>


</entry>

<entry>
<word>
 </word>


<meaning>
{}
</meaning>


</entry>

</root>
