<?xml version="1.0" encoding="UTF-8"?>
<!DOCTYPE root SYSTEM "dictionary.dtd">
<root>

<entry>
<word>
ṅa 1</word>


<meaning>
{ṅa} the 5th consonant of the Sanskṛit alphabet, nasal of the 1st class. No word in use begins with this letter 
</meaning>


<meaning>
 it is usually found as the 1st member of a conjunct consonant preceded by a vowel
</meaning>


</entry>

<entry>
<word>
 ṅakāra </word>


<meaning>
{kāra} m. the letter or sound {ṅa}
</meaning>


</entry>

<entry>
<word>
ṅa 2</word>


<meaning>
{ṅa} m. an object of sense <a href="/html/abbreviations.html#L">L.</a> 
</meaning>


<meaning>
 desire for any sensual object <a href="/html/abbreviations.html#L">L.</a> 
</meaning>


<meaning>
 Śiva ({bhairava}) <a href="/html/abbreviations.html#L">L.</a>
</meaning>


</entry>

<entry>
<word>
ṅu </word>


<meaning>
{ṅu} cl. 1. Ā. {ṅavate}, to sound <a href="/html/abbreviations.html#Dhātup">Dhātup.</a> xxii, 57: Desid. {ñuṇūṣate} <a href="/html/abbreviations.html#Pāṇ">Pāṇ.</a> 7-4, 62 <a href="/html/abbreviations.html#Sch">Sch.</a>
</meaning>


</entry>

<entry>
<word>
 </word>


<meaning>
{}
</meaning>


</entry>

</root>
