<?xml version="1.0" encoding="UTF-8"?>
<!DOCTYPE root SYSTEM "dictionary.dtd">
<root>

<entry>
<word>
tha 1</word>


<meaning>
{tha} aspirate of the preceding letter
</meaning>


</entry>

<entry>
<word>
 thakāra </word>


<meaning>
{kāra} m. the letter or sound {th}
</meaning>


</entry>

<entry>
<word>
 tha 2</word>


<meaning>
{tha} m. a mountain <a href="/html/abbreviations.html#L">L.</a> 
</meaning>


<meaning>
 a protector <a href="/html/abbreviations.html#L">L.</a> 
</meaning>


<meaning>
 a sign of danger <a href="/html/abbreviations.html#L">L.</a> 
</meaning>


<meaning>
 N. of a disease <a href="/html/abbreviations.html#L">L.</a> 
</meaning>


<meaning>
 eating <a href="/html/abbreviations.html#L">L.</a> 
</meaning>


<meaning>
 n. preservation <a href="/html/abbreviations.html#L">L.</a> 
</meaning>


<meaning>
 fear <a href="/html/abbreviations.html#L">L.</a> 
</meaning>


<meaning>
 an auspicious prayer <a href="/html/abbreviations.html#L">L.</a>
</meaning>


</entry>

<entry>
<word>
thakkana </word>


<meaning>
{thakkana} m. {ṭhakk} <a href="/html/abbreviations.html#Rājat">Rājat.</a>
</meaning>


</entry>

<entry>
<word>
thakriya </word>


<meaning>
{thakriya} m. N. of a man, iv, 493
</meaning>


</entry>

<entry>
<word>
thakviyaka </word>


<meaning>
{thakviyaka} N. of a man, v, 151
</meaning>


</entry>

<entry>
<word>
tharatharāya </word>


<meaning>
{tharatharāya} Nom. Ā. (p. {yamāna}) to grow giddy, tumble, Kārāṇḍ. xi, 130
</meaning>


</entry>

<entry>
<word>
tharv </word>


<meaning>
{tharv} cl. 1. P. to go <a href="/html/abbreviations.html#Nir">Nir.</a> xi, 18
</meaning>


</entry>

<entry>
<word>
thalyoraka </word>


<meaning>
{thalyoraka} N. of a village <a href="/html/abbreviations.html#Rājat">Rājat.</a>
</meaning>


</entry>

<entry>
<word>
thuḍ </word>


<meaning>
{thuḍ} cl. 6. {ḍati}, to cover <a href="/html/abbreviations.html#Dhātup">Dhātup.</a>
</meaning>


</entry>

<entry>
<word>
thutkāra </word>


<meaning>
{thut-kāra} m. = {thūt-k} <a href="/html/abbreviations.html#W">W.</a>
</meaning>


</entry>

<entry>
<word>
 thutthukāraka </word>


<meaning>
{thutthu-kāraka} mfn. one who smacks his lips in eating (not admitted into the <a href="/html/abbreviations.html#Buddh">Buddh.</a> brotherhood) <a href="/html/abbreviations.html#L">L.</a>
</meaning>


</entry>

<entry>
<word>
 thuthu </word>


<meaning>
{thuthu} = {thūthū}
</meaning>


</entry>

<entry>
<word>
 thuthukṛt </word>


<meaning>
{kṛt} m. N. of a bird <a href="/html/abbreviations.html#Npr">Npr.</a>
</meaning>


</entry>

<entry>
<word>
thurv </word>


<meaning>
{thurv} cl. 1. p. {thūrvat}, (Agni) hurting (cf. Dhātup. xv, 62 
</meaning>


<meaning>
 <a href="/html/abbreviations.html#√">√.</a>{turv}) <a href="/html/abbreviations.html#MaitrS">MaitrS.</a> ii, 10, 1
</meaning>


</entry>

<entry>
<word>
thūt </word>


<meaning>
{thūt} ind. (fr. {ṣṭhyūta} ?)
</meaning>


</entry>

<entry>
<word>
 thūtkāra </word>


<meaning>
{kāra} m. the sound made in spitting <a href="/html/abbreviations.html#Rājat">Rājat.</a> vii f
</meaning>


</entry>

<entry>
<word>
 thūtkṛta </word>


<meaning>
{kṛta} n. id., vii, 1116
</meaning>


</entry>

<entry>
<word>
 thūtkṛtya </word>


<meaning>
{kṛtya} ind. spitting <a href="/html/abbreviations.html#ib">ib.</a> 

</meaning>


</entry>

<entry>
<word>
 thūthū </word>


<meaning>
{thūthū} imitative sound of spitting, Sûktik
</meaning>


</entry>

<entry>
<word>
thaithai </word>


<meaning>
{thaithai} (in music) imitative sound of a musical instrument
</meaning>


</entry>

<entry>
<word>
thoḍana </word>


<meaning>
{thoḍana} n. fr. √{thuḍ} <a href="/html/abbreviations.html#W">W.</a>
</meaning>


</entry>

<entry>
<word>
thauṇeya </word>


<meaning>
{thauṇeya} {yaka} n. = {sth} <a href="/html/abbreviations.html#Car">Car.</a> vi f
</meaning>


</entry>

<entry>
<word>
 </word>


<meaning>
{}
</meaning>


</entry>

</root>
