<?xml version="1.0" encoding="UTF-8"?>
<!DOCTYPE root SYSTEM "dictionary.dtd">
<root>

<entry>
<word>
ḷ 1</word>


<meaning>
{ḷ} the ninth vowel of the alphabet (resembling the sound {lry} in {revelry} 
</meaning>


<meaning>
 it only appears in some forms of √{kḷp})
</meaning>


</entry>

<entry>
<word>
 ḷkāra </word>


<meaning>
{kāra}
</meaning>


</entry>

<entry>
<word>
 ḷvarṇa </word>


<meaning>
{varṇa} m. the sound {ḷ} <a href="/html/abbreviations.html#RPrāt">RPrāt.</a> <a href="/html/abbreviations.html#APrāt">APrāt.</a> <a href="/html/abbreviations.html#TPrāt">TPrāt.</a>
</meaning>


</entry>

<entry>
<word>
ḷ 2</word>


<meaning>
{ḷ} {ḷs} m. a mountain <a href="/html/abbreviations.html#L">L.</a> 
</meaning>


<meaning>
 the earth, the mother of the gods <a href="/html/abbreviations.html#L">L.</a>
</meaning>


</entry>

<entry>
<word>
ḷtaka </word>


<meaning>
{ḷtaka} {as} m. N. of a man, mispronunciation of Ṛitaka <a href="/html/abbreviations.html#Pat">Pat.</a> and <a href="/html/abbreviations.html#Kāś">Kāś.</a> on Śivasūtra 2
</meaning>


</entry>

<entry>
<word>
 </word>


<meaning>
{}
</meaning>


</entry>

</root>
