<?xml version="1.0" encoding="UTF-8"?>
<!DOCTYPE root SYSTEM "dictionary.dtd">
<root>

<entry>
<word>
ṇa 1</word>


<meaning>
{ṇa} the cerebral nasal <a href="/html/abbreviations.html#TPrāt">TPrāt.</a> xxi, 14
</meaning>


</entry>

<entry>
<word>
 ṇakāra </word>


<meaning>
{kāra} m. the letter or sound {ṇ}, vii, 1 ; xiii, 6
</meaning>


</entry>

<entry>
<word>
ṇa 2</word>


<meaning>
{ṇa} m. knowledge <a href="/html/abbreviations.html#L">L.</a> 
</meaning>


<meaning>
 certainty, ascertainment <a href="/html/abbreviations.html#L">L.</a> 
</meaning>


<meaning>
 ornament <a href="/html/abbreviations.html#L">L.</a> 
</meaning>


<meaning>
 a water-house <a href="/html/abbreviations.html#L">L.</a> 
</meaning>


<meaning>
 = {nirvṛti} (invented for the etymology of {kriṣṇa},) <a href="/html/abbreviations.html#MBh">MBh.</a> v, 70, 5 <a href="/html/abbreviations.html#Sch">Sch.</a> 
</meaning>


<meaning>
 a bad man <a href="/html/abbreviations.html#L">L.</a> 
</meaning>


<meaning>
 N. of Śiva or of a <a href="/html/abbreviations.html#Buddh">Buddh.</a> deity <a href="/html/abbreviations.html#L">L.</a> 
</meaning>


<meaning>
 the sound of negation <a href="/html/abbreviations.html#L">L.</a> 
</meaning>


<meaning>
 gift <a href="/html/abbreviations.html#L">L.</a>
</meaning>


</entry>

<entry>
<word>
ṇya </word>


<meaning>
{ṇya} m. (etymological) N. of an ocean in the Brahma-loka <a href="/html/abbreviations.html#ChUp">ChUp.</a> viii, 5, 3
</meaning>


</entry>

<entry>
<word>
 </word>


<meaning>
{}
</meaning>


</entry>

</root>
