<?xml version="1.0" encoding="UTF-8"?>
<!DOCTYPE root SYSTEM "dictionary.dtd">
<root>

<entry>
<word>
ḍha 1</word>


<meaning>
{ḍha} the aspirate of the preceding letter,
</meaning>


</entry>

<entry>
<word>
 ḍhakāra </word>


<meaning>
{kāra} m- the letter {ḍh}
</meaning>


</entry>

<entry>
<word>
ḍha 2</word>


<meaning>
{ḍha} mfn. = {nir-guṇa} <a href="/html/abbreviations.html#L">L.</a> 
</meaning>


<meaning>
 m. an imitative sound <a href="/html/abbreviations.html#L">L.</a> 
</meaning>


<meaning>
 a large drum <a href="/html/abbreviations.html#L">L.</a> 
</meaning>


<meaning>
 a dog <a href="/html/abbreviations.html#L">L.</a> 
</meaning>


<meaning>
 a dog's tail <a href="/html/abbreviations.html#L">L.</a> 
</meaning>


<meaning>
 a serpent <a href="/html/abbreviations.html#W">W.</a>
</meaning>


</entry>

<entry>
<word>
ḍhakka </word>


<meaning>
{ḍhakka} m. a large sacred building <a href="/html/abbreviations.html#Rājat">Rājat.</a> iii, v 
</meaning>


<meaning>
 N. of a locality (cf. {ṭakka}) <a href="/html/abbreviations.html#Mricch">Mricch.</a> <a href="/html/abbreviations.html#Sch">Sch.</a> Introd 
</meaning>


<meaning>
 ({ā}), f. a large drum (cf. {gaja-}, {jaya-}) <a href="/html/abbreviations.html#Rājat">Rājat.</a> vi, 133 
</meaning>


<meaning>
 covering, disappearance, W:
</meaning>


</entry>

<entry>
<word>
 ḍhakkadesīya </word>


<meaning>
{"ṣdesīya} mfn. spoken in the district of Ḍhakkia <a href="/html/abbreviations.html#Mṛicch">Mṛicch.</a> <a href="/html/abbreviations.html#Sch">Sch.</a> Introd
</meaning>


</entry>

<entry>
<word>
ḍhakkana </word>


<meaning>
{ḍhakkana} n. shutting (of a door) <a href="/html/abbreviations.html#Śīl">Śīl.</a> 
</meaning>


<meaning>
 m. N. of a man <a href="/html/abbreviations.html#Rājat">Rājat.</a> vi, 230f. (v. l. {kkama})
</meaning>


</entry>

<entry>
<word>
ḍhakkārī </word>


<meaning>
{ḍhakkārī} f. N. of the goddess Tārā or TariṇI, Kulasadbh
</meaning>


</entry>

<entry>
<word>
ḍhaṅka </word>


<meaning>
{ḍhaṅka} m. N. of a mountain <a href="/html/abbreviations.html#Śatr">Śatr.</a> i
</meaning>


</entry>

<entry>
<word>
ḍhaḍḍhara </word>


<meaning>
{ḍhaḍḍhara} N. of a man <a href="/html/abbreviations.html#HPariś">HPariś.</a> . xiii
</meaning>


</entry>

<entry>
<word>
ḍhaṇṭī </word>


<meaning>
{ḍhaṇṭī} f. = {vākya-viśeṣa} <a href="/html/abbreviations.html#Rudray">Rudray.</a>
</meaning>


</entry>

<entry>
<word>
ḍhāmarā </word>


<meaning>
{ḍhāmarā} f. a goose <a href="/html/abbreviations.html#Dhanaṃj">Dhanaṃj.</a>
</meaning>


</entry>

<entry>
<word>
ḍhārikā </word>


<meaning>
{ḍhārikā} f. the julus <a href="/html/abbreviations.html#ĀpGṛ">ĀpGṛ.</a>,
</meaning>


</entry>

<entry>
<word>
ḍhāla </word>


<meaning>
{ḍhāla} n. 'a shield', See {lin}
</meaning>


</entry>

<entry>
<word>
 ḍhālin </word>


<meaning>
{ḍhālin} mfn. armed with a shield, Rudraj
</meaning>


</entry>

<entry>
<word>
ḍhiṇḍhiṇikā </word>


<meaning>
{ḍhiṇḍhiṇikā} See {ṭiṇṭiṇ}
</meaning>


</entry>

<entry>
<word>
ḍhuḍhi </word>


<meaning>
{ḍhuḍhi} vḷ. for {ḍhuṇḍhi}
</meaning>


</entry>

<entry>
<word>
ḍhuṇḍh </word>


<meaning>
{ḍhuṇḍh} (a Sautra root), to search
</meaning>


</entry>

<entry>
<word>
 ḍhuṇḍhana </word>


<meaning>
{ḍhuṇḍhana} n. searching, investigating <a href="/html/abbreviations.html#W">W.</a>
</meaning>


</entry>

<entry>
<word>
 ḍhuṇḍhi </word>


<meaning>
{ḍhuṇḍhi} m. N. of Gaṇêsa <a href="/html/abbreviations.html#KāśīKh">KāśīKh.</a>
</meaning>


</entry>

<entry>
<word>
 ḍhuṇḍhirāja </word>


<meaning>
{rāja} m. N. of the author of a work on nativities 
</meaning>


<meaning>
 of Bālakṛishna's father 
</meaning>


<meaning>
 of Vināyaka-bhaṭṭa's father (about 1800 AḌ.) 
</meaning>


<meaning>
 {jâkhyāna} n. N. of <a href="/html/abbreviations.html#GaṇP">GaṇP.</a> ii, 43
</meaning>


</entry>

<entry>
<word>
 ḍhuṇḍhikā </word>


<meaning>
{ḍhuṇḍhikā} f. a gloss (?)
</meaning>


</entry>

<entry>
<word>
 ḍhuṇḍhita </word>


<meaning>
{ḍhuṇḍhita} mfn. sought, inquired <a href="/html/abbreviations.html#W">W.</a>
</meaning>


</entry>

<entry>
<word>
ḍheṅka </word>


<meaning>
{ḍheṅka} m. N. of a bird <a href="/html/abbreviations.html#Vasantar">Vasantar.</a>viii, 12 
</meaning>


<meaning>
 ({ī}), f. a kind of dance
</meaning>


</entry>

<entry>
<word>
 ḍheṅkikā </word>


<meaning>
{ḍheṅkikā} f. (in music) a kind of measure 
</meaning>


<meaning>
 {tāla} m. id. 

</meaning>


</entry>

<entry>
<word>
ḍhevvukā </word>


<meaning>
{ḍhevvukā} f. a coin, Kathârn
</meaning>


</entry>

<entry>
<word>
ḍhorasamudra </word>


<meaning>
{ḍhora-samudra} N. of a locality <a href="/html/abbreviations.html#Romakas">Romakas.</a>
</meaning>


</entry>

<entry>
<word>
 ḍholāsamudra </word>


<meaning>
{ḍholā-samudra} = {ḍhora-s} <a href="/html/abbreviations.html#W">W.</a>
</meaning>


</entry>

<entry>
<word>
 ḍhola </word>


<meaning>
{ḍhola} m. a large drum, Rudraj
</meaning>


</entry>

<entry>
<word>
 ḍholasamudrikā </word>


<meaning>
{"ṣsamudrikā} f. 'coming from or growing in Ḍhola-samudra (- {ḍhora-s}), Leea macrophylla <a href="/html/abbreviations.html#L">L.</a>
</meaning>


</entry>

<entry>
<word>
ḍhollarī </word>


<meaning>
{ḍhollarī} f. a kind of composition
</meaning>


</entry>

<entry>
<word>
ḍhauk </word>


<meaning>
{ḍhauk} cl. 1. Ā. {kate} (pf. {ḍuḍhauke} [<a href="/html/abbreviations.html#Pāṇ">Pāṇ.</a> 7-4, 59 <a href="/html/abbreviations.html#Kāś">Kāś.</a>] <a href="/html/abbreviations.html#Hcar">Hcar.</a> <a href="/html/abbreviations.html#Bhaṭṭ">Bhaṭṭ.</a>), to approach (with acc.) <a href="/html/abbreviations.html#Kād">Kād.</a> <a href="/html/abbreviations.html#Hcar">Hcar.</a> <a href="/html/abbreviations.html#Bhaṭṭ">Bhaṭṭ.</a>: Caus. {ḍhaukayati} (aor. {aḍuḍhaukat} <a href="/html/abbreviations.html#Pāṇ">Pāṇ.</a> 7-4, 2 and 59 <a href="/html/abbreviations.html#Kāś">Kāś.</a>), to bring near (to, gen.), cause to come near, offer, to any one (dat.) <a href="/html/abbreviations.html#Kathās">Kathās.</a> <a href="/html/abbreviations.html#Rājat">Rājat.</a> <a href="/html/abbreviations.html#Bhaṭṭ">Bhaṭṭ.</a> <a href="/html/abbreviations.html#KātyŚr">KātyŚr.</a> <a href="/html/abbreviations.html#Sch">Sch.</a>: Desid. {ḍuḍkaukiṣate} <a href="/html/abbreviations.html#Pāṇ">Pāṇ.</a> 7-4, 59 and viii, 4, 54 <a href="/html/abbreviations.html#Kāś">Kāś.</a>: Intens. {ḍoḍhaukyate}, vii, 4, 82 <a href="/html/abbreviations.html#Vārtt">Vārtt.</a> 1 <a href="/html/abbreviations.html#Pat">Pat.</a> 
</meaning>


<meaning>
 cf. {upa}.,
</meaning>


</entry>

<entry>
<word>
 ḍhaukana </word>


<meaning>
{ḍhaukana} n. offering, present <a href="/html/abbreviations.html#Rājat">Rājat.</a> vi, 166 <a href="/html/abbreviations.html#Śatr">Śatr.</a> xiv <a href="/html/abbreviations.html#KātyŚr">KātyŚr.</a> <a href="/html/abbreviations.html#Sch">Sch.</a> 
</meaning>


<meaning>
 cf. {upa-}
</meaning>


</entry>

<entry>
<word>
 ḍhaukita </word>


<meaning>
{ḍhaukita} mfn. brought near <a href="/html/abbreviations.html#MBh">MBh.</a> xii, 4138.
</meaning>


</entry>

<entry>
<word>
 </word>


<meaning>
{}
</meaning>


</entry>

</root>
